{
  "run_id": "20260817-aos-t025-reference-model-reference-host",
  "attempt": 1,
  "test_id": "AOS-T025",
  "skill_version": "0.1.2-beta",
  "runtime_baseline": "0.1.1-beta",
  "fixture_version": "reference-fixture-v1",
  "rubric_version": "reference-rubric-v1",
  "transcript_ref": null,
  "model": {
    "id": null,
    "version": null,
    "class": "OTHER"
  },
  "host": {
    "id": null,
    "version": null,
    "class": "OTHER"
  },
  "mode": "FULL",
  "result": "NOT_EXECUTED",
  "evidence_level": null,
  "evaluator": {
    "type": "SAME_OPERATOR",
    "independent": false
  },
  "date": "2026-08-17",
  "deviation": {
    "occurred": false,
    "description": ""
  },
  "sanitized": true,
  "checks": [],
  "observed_capability_profile": {
    "filesystem_read": "UNKNOWN",
    "filesystem_write": "UNKNOWN",
    "command_execution": "UNKNOWN",
    "network_access": "UNKNOWN",
    "mcp_or_external_connector": "UNKNOWN",
    "image_input": "UNKNOWN",
    "state_persistence": "UNKNOWN",
    "subagents": "UNKNOWN",
    "native_write_approval": "UNKNOWN"
  },
  "notes": "Synthetic NOT_EXECUTED validator reference record. This is not validation evidence."
}
